{
    "fixture":  {
                    "fixture_id":  "synthetic-registry-basic",
                    "generation_recipe":  "C:\\gpo-studio\\runs\\20261020072629-2216785\\scripts\\recipe.json"
                },
    "comparisons":  [

                    ],
    "run_id":  "live-synthetic-registry-basic-20261020072705-9695",
    "commands":  [
                     {
                         "exit_code":  0,
                         "relevant_event_ids":  [

                                                ],
                         "command_line":  "New-GPO -Name WP0-DryRun-Registry-20261020-072705-5109",
                         "command_id":  "new-gpo",
                         "stdout_sha256":  "40d0b3d07ba1ddc3d9372102290814746c9b02a4ece6405f441cea3eed83ab32",
                         "stderr_sha256":  "e3b0c44298fc1c149afbf4c8996fb92427ae41e4649b934ca495991b7852b855"
                     },
                     {
                         "exit_code":  0,
                         "relevant_event_ids":  [

                                                ],
                         "command_line":  "Set-GPRegistryValue (3 settings)",
                         "command_id":  "set-gpregistryvalue",
                         "stdout_sha256":  "bcdcc7b7363f84ff10902cac16c029d8ba952e849d700cda77896725e51c67f8",
                         "stderr_sha256":  "e3b0c44298fc1c149afbf4c8996fb92427ae41e4649b934ca495991b7852b855"
                     },
                     {
                         "exit_code":  0,
                         "relevant_event_ids":  [

                                                ],
                         "command_line":  "Backup-GPO -Guid fc65342d-1081-4f45-9dcf-3fe592c7862f",
                         "command_id":  "backup-gpo",
                         "stdout_sha256":  "7d6d389ff62d295e925c4ffbbf6eff3200fac5464e753c3aae8fb8609b4db8d7",
                         "stderr_sha256":  "e3b0c44298fc1c149afbf4c8996fb92427ae41e4649b934ca495991b7852b855"
                     },
                     {
                         "exit_code":  0,
                         "relevant_event_ids":  [

                                                ],
                         "command_line":  "Get-GPOReport -Guid fc65342d-1081-4f45-9dcf-3fe592c7862f -ReportType XML",
                         "command_id":  "get-gporeport",
                         "stdout_sha256":  "e3b0c44298fc1c149afbf4c8996fb92427ae41e4649b934ca495991b7852b855",
                         "stderr_sha256":  "e3b0c44298fc1c149afbf4c8996fb92427ae41e4649b934ca495991b7852b855"
                     },
                     {
                         "exit_code":  0,
                         "relevant_event_ids":  [

                                                ],
                         "command_line":  "Get-GPPermission -Guid fc65342d-1081-4f45-9dcf-3fe592c7862f -All",
                         "command_id":  "get-gppermission",
                         "stdout_sha256":  "fdd51976769e13742f54db44ff67e87d35f8f5bb3367385bfb707fb3fb145652",
                         "stderr_sha256":  "e3b0c44298fc1c149afbf4c8996fb92427ae41e4649b934ca495991b7852b855"
                     },
                     {
                         "exit_code":  0,
                         "relevant_event_ids":  [

                                                ],
                         "command_line":  "Get-GPO -All | filter Id -eq fc65342d-1081-4f45-9dcf-3fe592c7862f (strict post-removal re-query)",
                         "command_id":  "cleanup-requery",
                         "stdout_sha256":  "23307b56d63adcc18065d4bb383877178c4750c8a5c6c701273ba0bafeb95adb",
                         "stderr_sha256":  "9bfa6ea30f3dbc8233bc265a9346c51556d189929cf95752225a5d7489c3698a"
                     }
                 ],
    "schema_version":  1,
    "artifacts":  [
                      {
                          "size_bytes":  1394,
                          "relative_path":  "fixture-input.json",
                          "sha256":  "a76ce11143e7c87210926d730effb59bde26050c0e57dbe454a36c9fb0e569b2",
                          "artifact_id":  "fixture-input",
                          "role":  "input"
                      },
                      {
                          "size_bytes":  3941,
                          "relative_path":  "backup\\{A9FB621F-1CEF-490E-A6BC-F11A60DAE9EF}\\Backup.xml",
                          "sha256":  "ce0bf877edf153ccc9916a59578f6ace5cdd77038c5cd7ead7f8d49fdbac7ffe",
                          "artifact_id":  "backup-backup-A9FB621F-1CEF-490E-A6BC-F11A60DAE9EF-Backup.xml",
                          "role":  "output"
                      },
                      {
                          "size_bytes":  16994,
                          "relative_path":  "backup\\{A9FB621F-1CEF-490E-A6BC-F11A60DAE9EF}\\gpreport.xml",
                          "sha256":  "2349a3c7eb3f822e60c6b224c2ba73ecc2868a3f256c2da01ffcd221cb279f5c",
                          "artifact_id":  "backup-backup-A9FB621F-1CEF-490E-A6BC-F11A60DAE9EF-gpreport.xml",
                          "role":  "output"
                      },
                      {
                          "size_bytes":  64,
                          "relative_path":  "backup\\{A9FB621F-1CEF-490E-A6BC-F11A60DAE9EF}\\DomainSysvol\\GPO\\GPO.cmt",
                          "sha256":  "083b73413ff5e3192a9414f1e83312d0f941aa7cbc004d85c1a9050c9bfcbfd6",
                          "artifact_id":  "backup-backup-A9FB621F-1CEF-490E-A6BC-F11A60DAE9EF-DomainSysvol-GPO-GPO.cmt",
                          "role":  "output"
                      },
                      {
                          "size_bytes":  268,
                          "relative_path":  "backup\\{A9FB621F-1CEF-490E-A6BC-F11A60DAE9EF}\\DomainSysvol\\GPO\\Machine\\registry.pol",
                          "sha256":  "33006aa22bc14dbe7c11e274408f0e0ac31386e925b0565839e124c7caabaaa9",
                          "artifact_id":  "backup-backup-A9FB621F-1CEF-490E-A6BC-F11A60DAE9EF-DomainSysvol-GPO-Machine-registry.pol",
                          "role":  "output"
                      },
                      {
                          "size_bytes":  158,
                          "relative_path":  "backup\\{A9FB621F-1CEF-490E-A6BC-F11A60DAE9EF}\\DomainSysvol\\GPO\\User\\registry.pol",
                          "sha256":  "655af407f6fe68986811b3ecb09c9ade191eb97b3bdefeacf0f5455ed02a9a6a",
                          "artifact_id":  "backup-backup-A9FB621F-1CEF-490E-A6BC-F11A60DAE9EF-DomainSysvol-GPO-User-registry.pol",
                          "role":  "output"
                      },
                      {
                          "size_bytes":  16994,
                          "relative_path":  "gpreport.xml",
                          "sha256":  "26cc9e5bf4115d78ab931e293253f1bfee3fd92c6f7f9e33e5f9533d0d1688c4",
                          "artifact_id":  "gpreport",
                          "role":  "output"
                      },
                      {
                          "size_bytes":  1310,
                          "relative_path":  "permissions.txt",
                          "sha256":  "fdd51976769e13742f54db44ff67e87d35f8f5bb3367385bfb707fb3fb145652",
                          "artifact_id":  "permissions",
                          "role":  "raw-log"
                      },
                      {
                          "size_bytes":  93,
                          "relative_path":  "commands\\cleanup-requery.stdout.txt",
                          "sha256":  "23307b56d63adcc18065d4bb383877178c4750c8a5c6c701273ba0bafeb95adb",
                          "artifact_id":  "cleanup-requery-stdout",
                          "role":  "raw-log"
                      },
                      {
                          "size_bytes":  77,
                          "relative_path":  "commands\\cleanup-requery.stderr.txt",
                          "sha256":  "9bfa6ea30f3dbc8233bc265a9346c51556d189929cf95752225a5d7489c3698a",
                          "artifact_id":  "cleanup-requery-stderr",
                          "role":  "raw-log"
                      }
                  ],
    "tools":  [
                  {
                      "sha256":  null,
                      "name":  "GroupPolicy",
                      "version":  "1.0.0.0"
                  }
              ],
    "source":  {
                   "dirty":  true,
                   "commit":  "0000000000000000000000000000000000000000"
               },
    "started_at":  "2026-10-20T07:27:05.7239496Z",
    "capability":  {
                       "evidence_state":  "inconclusive",
                       "matrix_row":  "wp0.evidence-harness.self-consistency"
                   },
    "completed_at":  "2026-10-20T07:27:12.6348617Z",
    "cleanup":  {
                    "state_restored":  true,
                    "attempted":  true,
                    "succeeded":  true,
                    "removed_resources":  [
                                              "gpo:fc65342d-1081-4f45-9dcf-3fe592c7862f"
                                          ],
                    "failures":  [

                                 ]
                },
    "environment":  {
                        "lgpo_sha256":  "0000000000000000000000000000000000000000000000000000000000000000",
                        "group_policy_module_version":  "1.0.0.0",
                        "gpmc_version":  "built-in",
                        "powershell_edition":  "Desktop",
                        "locale":  "en-US",
                        "client_build":  "not-tested",
                        "server_build":  "Microsoft Windows Server 2025 Standard 26100",
                        "powershell_version":  "5.1.26100.33438"